{
  "@context": "https://linked.art/ns/v1/linked-art.json",
  "id": "https://linked.art/example/person/8",
  "type": "Person",
  "_label": "Amanda B. Curtlett",
  "born": {
    "type": "Birth",
    "timespan": {
      "type": "TimeSpan",
      "begin_of_the_begin": "1767-01-09",
      "end_of_the_end": "1767-01-12"
    }
  },
  "died": {
    "type": "Death",
    "timespan": {
      "type": "TimeSpan",
      "begin_of_the_begin": "1824-08-21",
      "end_of_the_end": "1824-08-21"
    },
    "took_place_at": [
      {
        "type": "Place",
        "_label": "Death Place"
      }
    ]
  }
}