{
  "@context": "https://linked.art/ns/v1/linked-art.json",
  "id": "https://linked.art/example/person/7",
  "type": "Person",
  "_label": "A. Bacchus",
  "member_of": [
    {
      "type": "Group",
      "_label": "Example City Museum",
      "classified_as": [
        {
          "id": "http://vocab.getty.edu/aat/300312281",
          "type": "Type",
          "_label": "Museum"
        }
      ],
      "contact_point": [
        {
          "type": "Identifier",
          "classified_as": [
            {
              "id": "http://vocab.getty.edu/aat/300386983",
              "type": "Type",
              "_label": "Street Address"
            }
          ],
          "content": "1200 Museum Drive, Example City"
        }
      ]
    }
  ],
  "contact_point": [
    {
      "type": "Identifier",
      "classified_as": [
        {
          "id": "http://vocab.getty.edu/aat/300435686",
          "type": "Type",
          "_label": "Email Address"
        }
      ],
      "content": "a.person@example.org"
    }
  ]
}