{
  "@context": "https://linked.art/ns/v1/linked-art.json",
  "id": "https://linked.art/example/person/13",
  "type": "Person",
  "_label": "Gertrude H. Ingram",
  "representation": [
    {
      "type": "VisualItem",
      "digitally_shown_by": [
        {
          "id": "http://example.org/images/gertrude.jpg",
          "type": "DigitalObject",
          "classified_as": [
            {
              "id": "http://vocab.getty.edu/aat/300215302",
              "type": "Type",
              "_label": "Digital Image"
            }
          ]
        }
      ]
    }
  ]
}