{
  "@context": "https://linked.art/ns/v1/linked-art.json",
  "id": "https://linked.art/example/person/14",
  "type": "Person",
  "_label": "Sameen T. Underwood",
  "member_of": [
    {
      "type": "Group",
      "_label": "Paintings Department",
      "classified_as": [
        {
          "id": "http://vocab.getty.edu/aat/300263534",
          "type": "Type",
          "_label": "Department"
        }
      ],
      "member_of": [
        {
          "type": "Group",
          "_label": "Example Museum",
          "classified_as": [
            {
              "id": "http://vocab.getty.edu/aat/300312281",
              "type": "Type",
              "_label": "Museum"
            }
          ]
        }
      ]
    }
  ]
}