{
  "@context": "https://linked.art/ns/v1/linked-art.json",
  "id": "https://linked.art/example/person/6",
  "type": "Person",
  "_label": "Vincent Van Gogh",
  "equivalent": [
    {
      "id": "http://vocab.getty.edu/ulan/500115588",
      "type": "Person",
      "_label": "Vincent Van Gogh"
    }
  ]
}