{
  "@context": "https://linked.art/ns/v1/linked-art.json",
  "id": "https://linked.art/example/person/9",
  "type": "Person",
  "_label": "Patrick Q. Robertson",
  "carried_out": [
    {
      "type": "Activity",
      "classified_as": [
        {
          "id": "http://vocab.getty.edu/aat/300393177",
          "type": "Type",
          "_label": "Professional Activities"
        }
      ],
      "timespan": {
        "type": "TimeSpan",
        "begin_of_the_begin": "1910-01-01",
        "end_of_the_end": "1934-03-21"
      }
    }
  ]
}