{
  "@context": "https://linked.art/ns/v1/linked-art.json",
  "id": "https://linked.art/example/person/5",
  "type": "Person",
  "_label": "Xavier Y. Zeelander",
  "identified_by": [
    {
      "type": "Identifier",
      "classified_as": [
        {
          "id": "http://vocab.getty.edu/aat/300404621",
          "type": "Type",
          "_label": "Owner-Assigned Number"
        }
      ],
      "content": "643"
    }
  ]
}