{
  "@context": "https://linked.art/ns/v1/linked-art.json",
  "id": "https://linked.art/example/person/11",
  "type": "Person",
  "_label": "Jeremy K. Lintott",
  "classified_as": [
    {
      "id": "http://vocab.getty.edu/aat/300111159",
      "type": "Type",
      "_label": "British",
      "classified_as": [
        {
          "id": "http://vocab.getty.edu/aat/300379842",
          "type": "Type",
          "_label": "Nationality"
        }
      ]
    }
  ]
}