{
  "@context": "https://linked.art/ns/v1/linked-art.json",
  "id": "https://linked.art/example/person/12",
  "type": "Person",
  "_label": "Mabel N. Overton",
  "classified_as": [
    {
      "id": "http://vocab.getty.edu/aat/300189557",
      "type": "Type",
      "_label": "Feminine",
      "classified_as": [
        {
          "id": "http://vocab.getty.edu/aat/300055147",
          "type": "Type",
          "_label": "Gender"
        }
      ]
    }
  ]
}