{
  "@context": "https://linked.art/ns/v1/linked-art.json",
  "id": "https://linked.art/example/person/10",
  "type": "Person",
  "_label": "David E. Frederickson",
  "referred_to_by": [
    {
      "type": "LinguisticObject",
      "classified_as": [
        {
          "id": "http://vocab.getty.edu/aat/300435422",
          "type": "Type",
          "_label": "Biography Statement",
          "classified_as": [
            {
              "id": "http://vocab.getty.edu/aat/300418049",
              "type": "Type",
              "_label": "Brief Text"
            }
          ]
        }
      ],
      "content": "David was born at a very early age."
    }
  ]
}